lexical-category	english	norwegian	pronunciation	example_sentence
noun	hotel	et hotell	/hʊˈtɛl/	Hotellet ligger nær stasjonen.
noun	reservation	en reservasjon	/resɛrʋɑˈʂuːn/	Jeg har en reservasjon.
noun	check-in	en innsjekk	/ˈɪnːʂɛk/	Innsjekk er fra klokka tre.
noun	check-out	en utsjekk	/ˈʉtʂɛk/	Utsjekk er klokka tolv.
noun	reception	en resepsjon	/resɛpˈʂuːn/	Resepsjonen er åpen hele døgnet.
noun	room key	et nøkkelkort	/ˈnøːkəlˌkɔʈ/	Nøkkelkortet fungerer ikke.
noun	passport	en pass	/pɑs/	Jeg må vise pass.
noun	luggage	en bagasje	/bɑˈɡɑːʂə/	Bagasjen min er tung.
noun	single room	et enkeltrom	/ˈɛŋkəlˌtrʊm/	Jeg vil ha et enkeltrom.
noun	double room	et dobbeltrom	/ˈdɔbːəlˌtrʊm/	Vi trenger et dobbeltrom.
noun	breakfast	en frokost	/ˈfruːkɔst/	Frokosten er inkludert.
noun	elevator	en heis	/hæɪs/	Heisen er til høyre.
noun	floor	en etasje	/ɛˈtɑːʂə/	Rommet er i femte etasje.
verb	to stay	å bo, bor, bodde, har bodd	/buː/	Vi skal bo her i tre netter.
verb	to book	å bestille, bestiller, bestillte, har bestillt	/beˈstɪlə/	Jeg vil bestille et rom.
adjective	available	ledig	/ˈleːdi/	Har dere et ledig rom?
expression	Is Wi-Fi included?	Er Wi-Fi inkludert?	/ær ˈʋiːfi ɪnkluˈdeːʈ/	Er Wi-Fi inkludert?
expression	Can I have a late check-out?	Kan jeg få sen utsjekk?	/kɑn jæɪ foː seːn ˈʉtʂɛk/	Kan jeg få sen utsjekk?
noun	map	et kart	/kɑʈ/	Har dere et kart over byen?
noun	booking	en bestilling	/beˈstɪlɪŋ/	Bestillingen er bekreftet.
noun	confirmation	en bekreftelse	/bəˈkrɛftəlsə/	Jeg har bekreftelse på e-post.
noun	guest	en gjest	/jɛst/	Gjestene venter.
noun	room	en rom	/ruːm/	Rommet er klart.
noun	room number	et romnummer	/ˈrʊmˌnʉmːər/	Romnummeret er 504.
noun	key card	et nøkkelkort	/ˈnøːkəlˌkɔʈ/	Nøkkelkortet virker ikke.
noun	luggage	en bagasje	/bɑˈɡɑːʂə/	Bagasjen er tung.
noun	suitcase	en koffert	/kʊˈfɛʈ/	Kofferten står her.
noun	bag	en bag	/bɑːɡ/	Jeg har en bag.
noun	backpack	en ryggsekk	/ˈrʏɡˌsɛk/	Ryggsekken er stor.
noun	breakfast buffet	en frokostbuffé	/ˈfruːkɔstˌbʉfeː/	Frokostbufféen åpner klokka sju.
noun	lunch	en lunsj	/lʉnʂ/	Lunsj er fra tolv.
noun	dinner	en middag	/ˈmɪdɑɡ/	Middagen serveres klokka seks.
noun	restaurant	en restaurant	/rɛstʉˈrɑŋ/	Hotellet har restaurant.
noun	bar	en bar	/bɑːr/	Baren er åpen.
noun	lobby	en lobby	/ˈlɔbi/	Vi møtes i lobbyen.
noun	lounge	en salong	/sɑˈlɔŋ/	Salongen er rolig.
noun	gym	en treningsrom	/ˈtreːnɪŋsˌrʊm/	Treningsrommet er i kjelleren.
noun	pool	et basseng	/bɑˈsɛŋ/	Bassenget er stengt.
noun	sauna	en badstue	/ˈbɑːdstʉə/	Badstua er varm.
noun	laundry	et vaskeri	/ʋɑˈskɛːri/	Vaskeriet er i første etasje.
noun	towel	et håndkle	/ˈhɔnːklə/	Jeg trenger et håndkle.
noun	bed	en seng	/sɛŋ/	Sengen er komfortabel.
noun	blanket	et teppe	/ˈtɛpːə/	Kan jeg få et ekstra teppe?
noun	pillow	en pute	/ˈpʉːtə/	Jeg trenger en ekstra pute.
noun	air conditioning	en aircondition	/ˈæːrˌkɔndɪʂuːn/	Aircondition virker ikke.
noun	heating	en varme	/ˈʋɑrmə/	Varmeen er av.
noun	noise	en støy	/stœy/	Det er mye støy.
noun	view	en utsikt	/ˈʉtˌsɪkt/	Rommet har fin utsikt.
noun	sea view	en havutsikt	/ˈhɑːʋˌʉtˌsɪkt/	Jeg vil ha havutsikt.
noun	city center	en sentrum	/ˈsɛntrʉm/	Hotellet ligger i sentrum.
noun	address	en adresse	/ɑˈdrɛsə/	Hva er adressen?
noun	tourist information	en turistinformasjon	/tʉˈrɪstˌɪnfɔrˈmɑʂuːn/	Turistinformasjonen er der.
noun	sight	en severdighet	/ˈseːʋərdɪˌheːt/	Det er mange severdigheter.
noun	ticket	en billett	/bɪˈlɛt/	Jeg kjøper en billett.
noun	guide	en guide	/ˈɡaɪdə/	Guiden starter klokka ti.
noun	tour	en omvisning	/ˈɔmˌʋiːsniŋ/	Vi blir med på omvisning.
noun	reservation number	et reservasjonsnummer	/resɛrʋɑˈʂuːnsˌnʉmːər/	Reservasjonsnummeret er her.
verb	to check in	å sjekke inn, sjekker inn, sjekket inn, har sjekket inn	/ˈʂɛkːə ɪn/	Vi sjekker inn nå.
verb	to check out	å sjekke ut, sjekker ut, sjekket ut, har sjekket ut	/ˈʂɛkːə ʉːt/	Vi sjekker ut klokka tolv.
verb	to book	å bestille, bestiller, bestillte, har bestillt	/beˈstɪlə/	Jeg vil bestille rom.
verb	to cancel	å avbestille, avbestiller, avbestillte, har avbestillt	/ˈɑːʋbəˌstɪlːə/	Jeg må avbestille.
verb	to pay	å betale, betaler, betalte, har betalt	/beˈtɑːlə/	Jeg betaler nå.
verb	to extend stay	å forlenge oppholdet, forlenger oppholdet, forlenget oppholdet, har forlenget oppholdet	/fɔrˈlɛŋə ˈɔpˌhɔlːət/	Jeg vil forlenge oppholdet.
verb	to store luggage	å oppbevare bagasje, oppbevarer bagasje, oppbevarte bagasje, har oppbevart bagasje	/ˈɔpːbəˌʋɑːrə bɑˈɡɑːʂə/	Kan dere oppbevare bagasjen?
verb	to wake up	å våkne, våkner, våknet, har våknet	/ˈʋoːknə/	Jeg våkner tidlig.
verb	to order a taxi	å bestille taxi, bestiller taxi, bestillte taxi, har bestillt taxi	/beˈstɪlə ˈtɑkːsi/	Kan du bestille taxi?
verb	to recommend	å anbefale, anbefaler, anbefalte, har anbefalt	/ˈɑnbəˌfɑːlə/	Kan du anbefale en restaurant?
adjective	available	ledig	/ˈleːdi/	Er det ledig rom?
adjective	occupied	opptatt	/ˈɔpːtɑt/	Rommet er opptatt.
adjective	clean	ren	/reːn/	Rommet er rent.
adjective	dirty	skittent	/ˈʂɪtːənt/	Badet er skittent.
adjective	quiet	stille	/ˈstɪlːə/	Rommet er stille.
adjective	noisy	bråkete	/ˈbrɔːkətə/	Det er bråkete om natten.
adjective	included	inkludert	/ɪnkluˈdeːʈ/	Frokost er inkludert.
adjective	extra	ekstra	/ˈɛkstrɑ/	Ekstra håndkle koster.
expression	I have a reservation.	Jeg har en reservasjon.	/jæɪ hɑr en resɛrʋɑˈʂuːn/	Jeg har en reservasjon.
expression	Can I have a room with a view?	Kan jeg få et rom med utsikt?	/kɑn jæɪ foː et rʊm meː ˈʉtˌsɪkt/	Kan jeg få et rom med utsikt?
expression	Is breakfast included?	Er frokost inkludert?	/æːr ˈfruːkɔst ɪnkluˈdeːʈ/	Er frokost inkludert?
expression	Can I get a wake-up call?	Kan jeg få vekking?	/kɑn jæɪ foː ˈʋɛkːɪŋ/	Kan jeg få vekking klokka sju?
expression	Where is the elevator?	Hvor er heisen?	/ʋuːr ær ˈhæɪsən/	Hvor er heisen?
noun	late check-out	en sen utsjekk	/seːn ˈʉtʂɛk/	Sen utsjekk koster ekstra.
noun	early check-in	en tidlig innsjekk	/ˈtiːdli ˈɪnːʂɛk/	Tidlig innsjekk er mulig.
noun	room service	en romservice	/ˈrʊmˌsærʋɪs/	Romservice er åpen.
noun	minibar	en minibar	/ˈmiːnɪˌbɑːr/	Minibaren er tom.
noun	parking	en parkering	/pɑrˈkeːrɪŋ/	Parkering er bak hotellet.
noun	Wi-Fi	en Wi-Fi	/ˈʋiːfi/	Wi-Fi-koden er her.
noun	password	et passord	/ˈpɑsɔʈ/	Hva er passordet?
noun	map	et kart	/kɑʈ/	Kan jeg få et kart?
noun	receipt	en kvittering	/kʋɪˈteːrɪŋ/	Kan jeg få kvittering?
noun	bill	en regning	/ˈreːnɪŋ/	Kan vi få regningen?
verb	to complain	å klage, klager, klaget, har klaget	/ˈklɑːɡə/	Jeg vil klage.
verb	to report	å melde, melder, meldte, har meldt	/ˈmɛlːə/	Jeg melder fra om støy.
verb	to lose	å miste, mister, mistet, har mistet	/ˈmɪstə/	Jeg har mistet nøkkelkortet.
adjective	broken	ødelagt	/ˈøːdəˌlɑkt/	TV-en er ødelagt.
adjective	comfortable	komfortabel	/kɔmfʊrˈtɑːbəl/	Sengen er komfortabel.
expression	The key card doesn't work.	Nøkkelkortet virker ikke.	/ˈnøːkəlˌkɔʈət ˈʋɪrːkər ˈɪkə/	Nøkkelkortet virker ikke.
expression	Can I leave my luggage?	Kan jeg sette igjen bagasjen?	/kɑn jæɪ ˈsɛtːə jæɪn bɑˈɡɑːʂən/	Kan jeg sette igjen bagasjen?
expression	Is there parking?	Er det parkering?	/æːr dɛ parkəˈreːrɪŋ/	Er det parkering her?
expression	I need a receipt.	Jeg trenger kvittering.	/jæɪ ˈtrɛŋər kʋɪˈteːrɪŋ/	Jeg trenger kvittering.
expression	Can you call a taxi?	Kan du ringe taxi?	/kɑn dʉ ˈrɪŋə ˈtɑkːsi/	Kan du ringe taxi?
noun	city map	et bykart	/ˈbyːˌkɑʈ/	Kan jeg få et bykart?
noun	guest name	et gjestenavn	/ˈjɛstənɑʋn/	Gjestenavnet står her.
noun	ID	en legitimasjon	/leɡitɪmɑˈʂuːn/	Jeg må vise legitimasjon.
noun	tourist tax	en turistskatt	/tʉˈrɪstˌskɑt/	Turistskatten er inkludert.
verb	to check availability	å sjekke tilgjengelighet, sjekker tilgjengelighet, sjekket tilgjengelighet, har sjekket tilgjengelighet	/ˈʂɛkːə tɪlˈjɛŋəlɪheːt/	Kan du sjekke tilgjengelighet?
verb	to pay with card	å betale med kort, betaler med kort, betalte med kort, har betalt med kort	/bəˈtɑːlə meː kɔʈ/	Jeg betaler med kort.
adjective	full	fullt	/fʉlt/	Hotellet er fullt.
expression	Do you have a quiet room?	Har dere et stille rom?	/hɑr ˈdeːrə et ˈstɪlːə rʊm/	Har dere et stille rom?
expression	Can I get an extra blanket?	Kan jeg få et ekstra teppe?	/kɑn jæɪ foː et ˈɛkstrɑ ˈtɛpːə/	Kan jeg få et ekstra teppe?
